Topic,Description,Register Adress,Unit& Scaling,type,AXSOL Name,AXSOL Unit & Scaling
Bsc_VarUxAval       ,Available inductive reactive power (underexcited)                ,1130,kvar,,,
Bsc_InvStrMod       ,Set operating state of inverter during startup                   ,2238,-   ,,,
Bsc_SrcSel          ,Select data source for setpoint specification                    ,2240,-   ,,,
Bsc_SOCOpHys        ,"SOC limitation, hysteresis                                       ",2258,%   ,,,
Bsc_SOCOpMax        ,Upper SOC limit until battery is charged. Manual specification   ,2260,%   ,,,
Bsc_SOCOpMin        ,Lower SOC limit until battery is discharged. Manual specification,2262,%   ,,,
